id,ukb_variable_description,number_participants,link
p31,Sex,502366,https://biobank.ndph.ox.ac.uk/ukb/field.cgi?id=31
p33,Date of birth,502366,https://biobank.ndph.ox.ac.uk/ukb/field.cgi?id=33
p34,Year of birth,502366,https://biobank.ndph.ox.ac.uk/ukb/field.cgi?id=34
p48,Waist circumference,500290,https://biobank.ndph.ox.ac.uk/ukb/field.cgi?id=48
p49,Hip circumference,500226,https://biobank.ndph.ox.ac.uk/ukb/field.cgi?id=49
p50,Standing height,499930,https://biobank.ndph.ox.ac.uk/ukb/field.cgi?id=50
p51,Seated height,497269,https://biobank.ndph.ox.ac.uk/ukb/field.cgi?id=51
p52,Month of birth,502366,https://biobank.ndph.ox.ac.uk/ukb/field.cgi?id=52
p54,UK Biobank assessment centre,502366,https://biobank.ndph.ox.ac.uk/ukb/field.cgi?id=54
p93,"Systolic blood pressure, manual reading",51604,https://biobank.ndph.ox.ac.uk/ukb/field.cgi?id=93
p94,"Diastolic blood pressure, manual reading",51604,https://biobank.ndph.ox.ac.uk/ukb/field.cgi?id=94
p95,Pulse rate (during blood-pressure measurement),51604,https://biobank.ndph.ox.ac.uk/ukb/field.cgi?id=95
p120,Birth weight known,501507,https://biobank.ndph.ox.ac.uk/ukb/field.cgi?id=120
p132,Job code at visit - entered,347110,https://biobank.ndph.ox.ac.uk/ukb/field.cgi?id=132
p135,Number of self-reported non-cancer illnesses,501525,https://biobank.ndph.ox.ac.uk/ukb/field.cgi?id=135
p137,Number of treatments/medications taken,501525,https://biobank.ndph.ox.ac.uk/ukb/field.cgi?id=137
p189,Townsend deprivation index at recruitment,501740,https://biobank.ndph.ox.ac.uk/ukb/field.cgi?id=189
p190,Reason lost to follow-up,1297,https://biobank.ndph.ox.ac.uk/ukb/field.cgi?id=190
p670,Type of accommodation lived in,501527,https://biobank.ndph.ox.ac.uk/ukb/field.cgi?id=670
p680,Own or rent accommodation lived in,500149,https://biobank.ndph.ox.ac.uk/ukb/field.cgi?id=680
p728,Number of vehicles in household,500147,https://biobank.ndph.ox.ac.uk/ukb/field.cgi?id=728
p738,Average total household income before tax,497480,https://biobank.ndph.ox.ac.uk/ukb/field.cgi?id=738
p757,Time employed in main current job,288701,https://biobank.ndph.ox.ac.uk/ukb/field.cgi?id=757
p845,Age completed full time education,337333,https://biobank.ndph.ox.ac.uk/ukb/field.cgi?id=845
p884,Number of days/week of moderate physical activity 10+ minutes,501512,https://biobank.ndph.ox.ac.uk/ukb/field.cgi?id=884
p894,Duration of moderate activity,420364,https://biobank.ndph.ox.ac.uk/ukb/field.cgi?id=894
p904,Number of days/week of vigorous physical activity 10+ minutes,501512,https://biobank.ndph.ox.ac.uk/ukb/field.cgi?id=904
p914,Duration of vigorous activity,307765,https://biobank.ndph.ox.ac.uk/ukb/field.cgi?id=914
p924,Usual walking pace,499626,https://biobank.ndph.ox.ac.uk/ukb/field.cgi?id=924
p1160,Sleep duration,501504,https://biobank.ndph.ox.ac.uk/ukb/field.cgi?id=1160
p1200,Sleeplessness / insomnia,501500,https://biobank.ndph.ox.ac.uk/ukb/field.cgi?id=1200
p1239,Current tobacco smoking,501500,https://biobank.ndph.ox.ac.uk/ukb/field.cgi?id=1239
p1249,Past tobacco smoking,464200,https://biobank.ndph.ox.ac.uk/ukb/field.cgi?id=1249
p1259,Smoking/smokers in household,461855,https://biobank.ndph.ox.ac.uk/ukb/field.cgi?id=1259
p1269,Exposure to tobacco smoke at home,464571,https://biobank.ndph.ox.ac.uk/ukb/field.cgi?id=1269
p1279,Exposure to tobacco smoke outside home,464571,https://biobank.ndph.ox.ac.uk/ukb/field.cgi?id=1279
p1558,Alcohol intake frequency.,501494,https://biobank.ndph.ox.ac.uk/ukb/field.cgi?id=1558
p1568,Average weekly red wine intake,349990,https://biobank.ndph.ox.ac.uk/ukb/field.cgi?id=1568
p1578,Average weekly champagne plus white wine intake,349989,https://biobank.ndph.ox.ac.uk/ukb/field.cgi?id=1578
p1647,Country of birth (UK/elsewhere),501472,https://biobank.ndph.ox.ac.uk/ukb/field.cgi?id=1647
p1677,Breastfed as a baby,501472,https://biobank.ndph.ox.ac.uk/ukb/field.cgi?id=1677
p1787,Maternal smoking around birth,494132,https://biobank.ndph.ox.ac.uk/ukb/field.cgi?id=1787
p1807,Father's age at death,390993,https://biobank.ndph.ox.ac.uk/ukb/field.cgi?id=1807
p1845,Mother's age,199383,https://biobank.ndph.ox.ac.uk/ukb/field.cgi?id=1845
p1873,Number of full brothers,494177,https://biobank.ndph.ox.ac.uk/ukb/field.cgi?id=1873
p1883,Number of full sisters,494177,https://biobank.ndph.ox.ac.uk/ukb/field.cgi?id=1883
p2178,Overall health rating,501473,https://biobank.ndph.ox.ac.uk/ukb/field.cgi?id=2178
p2415,Had major operations,228611,https://biobank.ndph.ox.ac.uk/ukb/field.cgi?id=2415
p2443,Diabetes diagnosed by doctor,501460,https://biobank.ndph.ox.ac.uk/ukb/field.cgi?id=2443
p2473,Other serious medical condition/disability diagnosed by doctor,501460,https://biobank.ndph.ox.ac.uk/ukb/field.cgi?id=2473
p2492,Taking other prescription medications,501460,https://biobank.ndph.ox.ac.uk/ukb/field.cgi?id=2492
p2644,"Light smokers, at least 100 smokes in lifetime",143238,https://biobank.ndph.ox.ac.uk/ukb/field.cgi?id=2644
p2654,Non-butter spread type details,265818,https://biobank.ndph.ox.ac.uk/ukb/field.cgi?id=2654
p2664,Reason for reducing amount of alcohol drunk,223963,https://biobank.ndph.ox.ac.uk/ukb/field.cgi?id=2664
p2674,Ever had breast cancer screening / mammogram,272839,https://biobank.ndph.ox.ac.uk/ukb/field.cgi?id=2674
p2684,Years since last breast cancer screening / mammogram,226216,https://biobank.ndph.ox.ac.uk/ukb/field.cgi?id=2684
p2714,Age when periods started (menarche),272839,https://biobank.ndph.ox.ac.uk/ukb/field.cgi?id=2714
p2724,Had menopause,272839,https://biobank.ndph.ox.ac.uk/ukb/field.cgi?id=2724
p2734,Number of live births,272837,https://biobank.ndph.ox.ac.uk/ukb/field.cgi?id=2734
p2784,Ever taken oral contraceptive pill,272836,https://biobank.ndph.ox.ac.uk/ukb/field.cgi?id=2784
p2794,Age started oral contraceptive pill,220822,https://biobank.ndph.ox.ac.uk/ukb/field.cgi?id=2794
p2804,Age when last used oral contraceptive pill,220515,https://biobank.ndph.ox.ac.uk/ukb/field.cgi?id=2804
p2814,Ever used hormone-replacement therapy (HRT),272836,https://biobank.ndph.ox.ac.uk/ukb/field.cgi?id=2814
p2844,Had other major operations,272836,https://biobank.ndph.ox.ac.uk/ukb/field.cgi?id=2844
p2867,Age started smoking in former smokers,124379,https://biobank.ndph.ox.ac.uk/ukb/field.cgi?id=2867
p2877,Type of tobacco previously smoked,124379,https://biobank.ndph.ox.ac.uk/ukb/field.cgi?id=2877
p2887,Number of cigarettes previously smoked daily,118902,https://biobank.ndph.ox.ac.uk/ukb/field.cgi?id=2887
p2897,Age stopped smoking,124379,https://biobank.ndph.ox.ac.uk/ukb/field.cgi?id=2897
p2907,Ever stopped smoking for 6+ months,123655,https://biobank.ndph.ox.ac.uk/ukb/field.cgi?id=2907
p2946,Father's age,114695,https://biobank.ndph.ox.ac.uk/ukb/field.cgi?id=2946
p2966,Age high blood pressure diagnosed,143703,https://biobank.ndph.ox.ac.uk/ukb/field.cgi?id=2966
p2976,Age diabetes diagnosed,27887,https://biobank.ndph.ox.ac.uk/ukb/field.cgi?id=2976
p2986,Started insulin within one year diagnosis of diabetes,27913,https://biobank.ndph.ox.ac.uk/ukb/field.cgi?id=2986
p3140,Pregnant,272489,https://biobank.ndph.ox.ac.uk/ukb/field.cgi?id=3140
p3426,Job involves night shift work,52131,https://biobank.ndph.ox.ac.uk/ukb/field.cgi?id=3426
p3436,Age started smoking in current smokers,39595,https://biobank.ndph.ox.ac.uk/ukb/field.cgi?id=3436
p3446,Type of tobacco currently smoked,39595,https://biobank.ndph.ox.ac.uk/ukb/field.cgi?id=3446
p3456,Number of cigarettes currently smoked daily (current cigarette smokers),36798,https://biobank.ndph.ox.ac.uk/ukb/field.cgi?id=3456
p3486,Ever tried to stop smoking,39595,https://biobank.ndph.ox.ac.uk/ukb/field.cgi?id=3486
p3506,Smoking compared to 10 years previous,39595,https://biobank.ndph.ox.ac.uk/ukb/field.cgi?id=3506
p3526,Mother's age at death,316884,https://biobank.ndph.ox.ac.uk/ukb/field.cgi?id=3526
p3536,Age started hormone-replacement therapy (HRT),107176,https://biobank.ndph.ox.ac.uk/ukb/field.cgi?id=3536
p3546,Age last used hormone-replacement therapy (HRT),107176,https://biobank.ndph.ox.ac.uk/ukb/field.cgi?id=3546
p3581,Age at menopause (last menstrual period),177882,https://biobank.ndph.ox.ac.uk/ukb/field.cgi?id=3581
p3659,Year immigrated to UK (United Kingdom),44539,https://biobank.ndph.ox.ac.uk/ukb/field.cgi?id=3659
p3700,Time since last menstrual period,64164,https://biobank.ndph.ox.ac.uk/ukb/field.cgi?id=3700
p3710,Length of menstrual cycle,64164,https://biobank.ndph.ox.ac.uk/ukb/field.cgi?id=3710
p3731,Former alcohol drinker,43179,https://biobank.ndph.ox.ac.uk/ukb/field.cgi?id=3731
p3872,Age of primiparous women at birth of child,36532,https://biobank.ndph.ox.ac.uk/ukb/field.cgi?id=3872
p3894,Age heart attack diagnosed,12571,https://biobank.ndph.ox.ac.uk/ukb/field.cgi?id=3894
p4056,Age stroke diagnosed,8527,https://biobank.ndph.ox.ac.uk/ukb/field.cgi?id=4056
p4079,"Diastolic blood pressure, automated reading",475844,https://biobank.ndph.ox.ac.uk/ukb/field.cgi?id=4079
p4080,"Systolic blood pressure, automated reading",475839,https://biobank.ndph.ox.ac.uk/ukb/field.cgi?id=4080
p4081,Method of measuring blood pressure,501525,https://biobank.ndph.ox.ac.uk/ukb/field.cgi?id=4081
p4136,Arterial pulse-wave stiffness device ID,226959,https://biobank.ndph.ox.ac.uk/ukb/field.cgi?id=4136
p4194,Pulse rate,219575,https://biobank.ndph.ox.ac.uk/ukb/field.cgi?id=4194
p4195,Pulse wave reflection index,219575,https://biobank.ndph.ox.ac.uk/ukb/field.cgi?id=4195
p4196,Pulse wave peak to peak time,219452,https://biobank.ndph.ox.ac.uk/ukb/field.cgi?id=4196
p4501,Non-accidental death in close genetic family,224839,https://biobank.ndph.ox.ac.uk/ukb/field.cgi?id=4501
p4548,Health satisfaction,227981,https://biobank.ndph.ox.ac.uk/ukb/field.cgi?id=4548
p4674,Private healthcare,227981,https://biobank.ndph.ox.ac.uk/ukb/field.cgi?id=4674
p6014,Doctor restricts physical activity due to heart condition,96522,https://biobank.ndph.ox.ac.uk/ukb/field.cgi?id=6014
p6139,Gas or solid-fuel cooking/heating,498841,https://biobank.ndph.ox.ac.uk/ukb/field.cgi?id=6139
p6140,Heating type(s) in home,227981,https://biobank.ndph.ox.ac.uk/ukb/field.cgi?id=6140
p6142,Current employment status,501520,https://biobank.ndph.ox.ac.uk/ukb/field.cgi?id=6142
p6143,Transport type for commuting to job workplace,268132,https://biobank.ndph.ox.ac.uk/ukb/field.cgi?id=6143
p6153,"Medication for cholesterol, blood pressure, diabetes, or take exogenous hormones",271367,https://biobank.ndph.ox.ac.uk/ukb/field.cgi?id=6153
p6155,Vitamin and mineral supplements,498777,https://biobank.ndph.ox.ac.uk/ukb/field.cgi?id=6155
p6160,Leisure/social activities,501508,https://biobank.ndph.ox.ac.uk/ukb/field.cgi?id=6160
p6162,Types of transport used (excluding work),496959,https://biobank.ndph.ox.ac.uk/ukb/field.cgi?id=6162
p6164,Types of physical activity in last 4 weeks,497212,https://biobank.ndph.ox.ac.uk/ukb/field.cgi?id=6164
p6177,"Medication for cholesterol, blood pressure or diabetes",227398,https://biobank.ndph.ox.ac.uk/ukb/field.cgi?id=6177
p6179,Mineral and other dietary supplements,498776,https://biobank.ndph.ox.ac.uk/ukb/field.cgi?id=6179
p6183,Number of cigarettes previously smoked daily (current cigar/pipe smokers),1821,https://biobank.ndph.ox.ac.uk/ukb/field.cgi?id=6183
p6194,Age stopped smoking cigarettes (current cigar/pipe or previous cigarette smoker),1821,https://biobank.ndph.ox.ac.uk/ukb/field.cgi?id=6194
p12143,Weight (pre-imaging),70442,https://biobank.ndph.ox.ac.uk/ukb/field.cgi?id=12143
p12144,Height,70442,https://biobank.ndph.ox.ac.uk/ukb/field.cgi?id=12144
p20003,Treatment/medication code,376448,https://biobank.ndph.ox.ac.uk/ukb/field.cgi?id=20003
p20004,Operation code,401986,https://biobank.ndph.ox.ac.uk/ukb/field.cgi?id=20004
p20008,Interpolated Year when non-cancer illness first diagnosed,391819,https://biobank.ndph.ox.ac.uk/ukb/field.cgi?id=20008
p20015,Sitting height,497268,https://biobank.ndph.ox.ac.uk/ukb/field.cgi?id=20015
p20022,Birth weight,280170,https://biobank.ndph.ox.ac.uk/ukb/field.cgi?id=20022
p20024,Job code at visit - deduced,14546,https://biobank.ndph.ox.ac.uk/ukb/field.cgi?id=20024
p20076,Treatment/medication READ-code,-1,https://biobank.ndph.ox.ac.uk/ukb/field.cgi?id=20076
p20107,Illnesses of father,488092,https://biobank.ndph.ox.ac.uk/ukb/field.cgi?id=20107
p20110,Illnesses of mother,492905,https://biobank.ndph.ox.ac.uk/ukb/field.cgi?id=20110
p20111,Illnesses of siblings,434161,https://biobank.ndph.ox.ac.uk/ukb/field.cgi?id=20111
p20115,Country of Birth (non-UK origin),40557,https://biobank.ndph.ox.ac.uk/ukb/field.cgi?id=20115
p20116,Smoking status,501500,https://biobank.ndph.ox.ac.uk/ukb/field.cgi?id=20116
p20117,Alcohol drinker status,501494,https://biobank.ndph.ox.ac.uk/ukb/field.cgi?id=20117
p20118,Home area population density - urban or rural,497314,https://biobank.ndph.ox.ac.uk/ukb/field.cgi?id=20118
p20119,Current employment status - corrected,3364,https://biobank.ndph.ox.ac.uk/ukb/field.cgi?id=20119
p20160,Ever smoked,499652,https://biobank.ndph.ox.ac.uk/ukb/field.cgi?id=20160
p20161,Pack years of smoking,153151,https://biobank.ndph.ox.ac.uk/ukb/field.cgi?id=20161
p20162,Pack years adult smoking as proportion of life span exposed to smoking,153151,https://biobank.ndph.ox.ac.uk/ukb/field.cgi?id=20162
p20277,Job code at visit,342563,https://biobank.ndph.ox.ac.uk/ukb/field.cgi?id=20277
p21000,Ethnic background,501479,https://biobank.ndph.ox.ac.uk/ukb/field.cgi?id=21000
p21001,Body mass index (BMI),499393,https://biobank.ndph.ox.ac.uk/ukb/field.cgi?id=21001
p21002,Weight,499705,https://biobank.ndph.ox.ac.uk/ukb/field.cgi?id=21002
p21003,Age when attended assessment centre,502366,https://biobank.ndph.ox.ac.uk/ukb/field.cgi?id=21003
p21021,Pulse wave Arterial Stiffness index,218468,https://biobank.ndph.ox.ac.uk/ukb/field.cgi?id=21021
p21022,Age at recruitment,502366,https://biobank.ndph.ox.ac.uk/ukb/field.cgi?id=21022
p21110,Android fat free mass,36131,https://biobank.ndph.ox.ac.uk/ukb/field.cgi?id=21110
p21111,Android tissue mass,36131,https://biobank.ndph.ox.ac.uk/ukb/field.cgi?id=21111
p21123,Gynoid fat free mass,36131,https://biobank.ndph.ox.ac.uk/ukb/field.cgi?id=21123
p21124,Gynoid tissue mass,36131,https://biobank.ndph.ox.ac.uk/ukb/field.cgi?id=21124
p22033,Summed days activity,394466,https://biobank.ndph.ox.ac.uk/ukb/field.cgi?id=22033
p22034,Summed minutes activity,394466,https://biobank.ndph.ox.ac.uk/ukb/field.cgi?id=22034
p22035,At or above moderate/vigorous recommendation,394466,https://biobank.ndph.ox.ac.uk/ukb/field.cgi?id=22035
p22036,At or above moderate/vigorous/walking recommendation,394466,https://biobank.ndph.ox.ac.uk/ukb/field.cgi?id=22036
p22037,MET minutes per week for walking,394466,https://biobank.ndph.ox.ac.uk/ukb/field.cgi?id=22037
p22038,MET minutes per week for moderate activity,394466,https://biobank.ndph.ox.ac.uk/ukb/field.cgi?id=22038
p22039,MET minutes per week for vigorous activity,394466,https://biobank.ndph.ox.ac.uk/ukb/field.cgi?id=22039
p22040,Summed MET minutes per week for all activity,394466,https://biobank.ndph.ox.ac.uk/ukb/field.cgi?id=22040
p22189,Townsend deprivation index at recruitment,501740,https://biobank.ndph.ox.ac.uk/ukb/field.cgi?id=22189
p22190,Unadjusted T/S ratio,473953,https://biobank.ndph.ox.ac.uk/ukb/field.cgi?id=22190
p22191,Adjusted T/S ratio,473953,https://biobank.ndph.ox.ac.uk/ukb/field.cgi?id=22191
p22192,Z-adjusted T/S log,473953,https://biobank.ndph.ox.ac.uk/ukb/field.cgi?id=22192
p22200,Year of birth,121248,https://biobank.ndph.ox.ac.uk/ukb/field.cgi?id=22200
p22426,Average heart rate,39695,https://biobank.ndph.ox.ac.uk/ukb/field.cgi?id=22426
p22433,Weight-to-muscle ratio,39436,https://biobank.ndph.ox.ac.uk/ukb/field.cgi?id=22433
p22506,Tobacco smoking,121248,https://biobank.ndph.ox.ac.uk/ukb/field.cgi?id=22506
p22507,Age of stopping smoking,43998,https://biobank.ndph.ox.ac.uk/ukb/field.cgi?id=22507
p22508,Amount of tobacco currently smoked,2870,https://biobank.ndph.ox.ac.uk/ukb/field.cgi?id=22508
p22599,Number of jobs held,118651,https://biobank.ndph.ox.ac.uk/ukb/field.cgi?id=22599
p22600,Job title,120271,https://biobank.ndph.ox.ac.uk/ukb/field.cgi?id=22600
p22601,Job coding,120271,https://biobank.ndph.ox.ac.uk/ukb/field.cgi?id=22601
p22617,Job code - historical,120271,https://biobank.ndph.ox.ac.uk/ukb/field.cgi?id=22617
p26212,Standard PRS for atrial fibrillation (AF),486128,https://biobank.ndph.ox.ac.uk/ukb/field.cgi?id=26212
p26213,Enhanced PRS for atrial fibrillation (AF),104592,https://biobank.ndph.ox.ac.uk/ukb/field.cgi?id=26213
p26216,Standard PRS for body mass index (BMI),486128,https://biobank.ndph.ox.ac.uk/ukb/field.cgi?id=26216
p26217,Enhanced PRS for body mass index (BMI),104592,https://biobank.ndph.ox.ac.uk/ukb/field.cgi?id=26217
p26223,Standard PRS for cardiovascular disease (CVD),486128,https://biobank.ndph.ox.ac.uk/ukb/field.cgi?id=26223
p26224,Enhanced PRS for cardiovascular disease (CVD),104592,https://biobank.ndph.ox.ac.uk/ukb/field.cgi?id=26224
p26227,Standard PRS for coronary artery disease (CAD),486128,https://biobank.ndph.ox.ac.uk/ukb/field.cgi?id=26227
p26228,Enhanced PRS for coronary artery disease (CAD),104592,https://biobank.ndph.ox.ac.uk/ukb/field.cgi?id=26228
p26236,Enhanced PRS for estimated glomerular filtration rate (creatinine based) (EGCR),104592,https://biobank.ndph.ox.ac.uk/ukb/field.cgi?id=26236
p26237,Enhanced PRS for estimated glomerular filtration rate (cystatin based) (EGCY),104592,https://biobank.ndph.ox.ac.uk/ukb/field.cgi?id=26237
p26238,Standard PRS for glycated haemoglobin (HBA1C_DF),486128,https://biobank.ndph.ox.ac.uk/ukb/field.cgi?id=26238
p26239,Enhanced PRS for glycated haemoglobin (HBA1C_DF),104592,https://biobank.ndph.ox.ac.uk/ukb/field.cgi?id=26239
p26242,Standard PRS for high density lipoprotein cholesterol (HDL),486128,https://biobank.ndph.ox.ac.uk/ukb/field.cgi?id=26242
p26243,Enhanced PRS for high density lipoprotein cholesterol (HDL),104592,https://biobank.ndph.ox.ac.uk/ukb/field.cgi?id=26243
p26244,Standard PRS for hypertension (HT),486128,https://biobank.ndph.ox.ac.uk/ukb/field.cgi?id=26244
p26245,Enhanced PRS for hypertension (HT),104592,https://biobank.ndph.ox.ac.uk/ukb/field.cgi?id=26245
p26285,Standard PRS for type 2 diabetes (T2D),486128,https://biobank.ndph.ox.ac.uk/ukb/field.cgi?id=26285
p26286,Enhanced PRS for type 2 diabetes (T2D),104592,https://biobank.ndph.ox.ac.uk/ukb/field.cgi?id=26286
p26410,Index of Multiple Deprivation (England),432607,https://biobank.ndph.ox.ac.uk/ukb/field.cgi?id=26410
p26411,Income score (England),432607,https://biobank.ndph.ox.ac.uk/ukb/field.cgi?id=26411
p26412,Employment score (England),432607,https://biobank.ndph.ox.ac.uk/ukb/field.cgi?id=26412
p26413,Health score (England),432607,https://biobank.ndph.ox.ac.uk/ukb/field.cgi?id=26413
p26414,Education score (England),432607,https://biobank.ndph.ox.ac.uk/ukb/field.cgi?id=26414
p26415,Housing score (England),432607,https://biobank.ndph.ox.ac.uk/ukb/field.cgi?id=26415
p26416,Crime score (England),432607,https://biobank.ndph.ox.ac.uk/ukb/field.cgi?id=26416
p26417,Living environment score (England),432607,https://biobank.ndph.ox.ac.uk/ukb/field.cgi?id=26417
p26418,Income score (Wales),21182,https://biobank.ndph.ox.ac.uk/ukb/field.cgi?id=26418
p26419,Employment score (Wales),21182,https://biobank.ndph.ox.ac.uk/ukb/field.cgi?id=26419
p26420,Health score (Wales),21182,https://biobank.ndph.ox.ac.uk/ukb/field.cgi?id=26420
p26421,Education score (Wales),21182,https://biobank.ndph.ox.ac.uk/ukb/field.cgi?id=26421
p26422,Access to services score (Wales),21182,https://biobank.ndph.ox.ac.uk/ukb/field.cgi?id=26422
p26423,Housing score (Wales),21182,https://biobank.ndph.ox.ac.uk/ukb/field.cgi?id=26423
p26424,Physical environment score (Wales),21182,https://biobank.ndph.ox.ac.uk/ukb/field.cgi?id=26424
p26425,Community safety score (Wales),21182,https://biobank.ndph.ox.ac.uk/ukb/field.cgi?id=26425
p26426,Index of Multiple Deprivation (Wales),21182,https://biobank.ndph.ox.ac.uk/ukb/field.cgi?id=26426
p26427,Index of Multiple Deprivation (Scotland),35845,https://biobank.ndph.ox.ac.uk/ukb/field.cgi?id=26427
p26428,Income score (Scotland),35845,https://biobank.ndph.ox.ac.uk/ukb/field.cgi?id=26428
p26429,Employment score (Scotland),35845,https://biobank.ndph.ox.ac.uk/ukb/field.cgi?id=26429
p26430,Health score (Scotland),35845,https://biobank.ndph.ox.ac.uk/ukb/field.cgi?id=26430
p26431,Education score (Scotland),35845,https://biobank.ndph.ox.ac.uk/ukb/field.cgi?id=26431
p26432,Housing score (Scotland),35845,https://biobank.ndph.ox.ac.uk/ukb/field.cgi?id=26432
p26433,Access to services score (Scotland),35845,https://biobank.ndph.ox.ac.uk/ukb/field.cgi?id=26433
p26434,Crime score (Scotland),33485,https://biobank.ndph.ox.ac.uk/ukb/field.cgi?id=26434
p30020,Haemoglobin concentration,479219,https://biobank.ndph.ox.ac.uk/ukb/field.cgi?id=30020
p30030,Haematocrit percentage,479220,https://biobank.ndph.ox.ac.uk/ukb/field.cgi?id=30030
p30050,Mean corpuscular haemoglobin,479216,https://biobank.ndph.ox.ac.uk/ukb/field.cgi?id=30050
p30060,Mean corpuscular haemoglobin concentration,479213,https://biobank.ndph.ox.ac.uk/ukb/field.cgi?id=30060
p30500,Microalbumin in urine,156559,https://biobank.ndph.ox.ac.uk/ukb/field.cgi?id=30500
p30510,Creatinine (enzymatic) in urine,484824,https://biobank.ndph.ox.ac.uk/ukb/field.cgi?id=30510
p30600,Albumin,432221,https://biobank.ndph.ox.ac.uk/ukb/field.cgi?id=30600
p30610,Alkaline phosphatase,470729,https://biobank.ndph.ox.ac.uk/ukb/field.cgi?id=30610
p30620,Alanine aminotransferase,470528,https://biobank.ndph.ox.ac.uk/ukb/field.cgi?id=30620
p30630,Apolipoprotein A,429675,https://biobank.ndph.ox.ac.uk/ukb/field.cgi?id=30630
p30640,Apolipoprotein B,468384,https://biobank.ndph.ox.ac.uk/ukb/field.cgi?id=30640
p30650,Aspartate aminotransferase,468980,https://biobank.ndph.ox.ac.uk/ukb/field.cgi?id=30650
p30660,Direct bilirubin,400913,https://biobank.ndph.ox.ac.uk/ukb/field.cgi?id=30660
p30670,Urea,470408,https://biobank.ndph.ox.ac.uk/ukb/field.cgi?id=30670
p30690,Cholesterol,470716,https://biobank.ndph.ox.ac.uk/ukb/field.cgi?id=30690
p30700,Creatinine,470493,https://biobank.ndph.ox.ac.uk/ukb/field.cgi?id=30700
p30710,C-reactive protein,469727,https://biobank.ndph.ox.ac.uk/ukb/field.cgi?id=30710
p30720,Cystatin C,470687,https://biobank.ndph.ox.ac.uk/ukb/field.cgi?id=30720
p30730,Gamma glutamyltransferase,470474,https://biobank.ndph.ox.ac.uk/ukb/field.cgi?id=30730
p30740,Glucose,431727,https://biobank.ndph.ox.ac.uk/ukb/field.cgi?id=30740
p30750,Glycated haemoglobin (HbA1c),467782,https://biobank.ndph.ox.ac.uk/ukb/field.cgi?id=30750
p30760,HDL cholesterol,432018,https://biobank.ndph.ox.ac.uk/ukb/field.cgi?id=30760
p30770,IGF-1,468257,https://biobank.ndph.ox.ac.uk/ukb/field.cgi?id=30770
p30780,LDL direct,469878,https://biobank.ndph.ox.ac.uk/ukb/field.cgi?id=30780
p30790,Lipoprotein A,377555,https://biobank.ndph.ox.ac.uk/ukb/field.cgi?id=30790
p30840,Total bilirubin,468757,https://biobank.ndph.ox.ac.uk/ukb/field.cgi?id=30840
p30870,Triglycerides,470346,https://biobank.ndph.ox.ac.uk/ukb/field.cgi?id=30870
p40000,Date of death,44499,https://biobank.ndph.ox.ac.uk/ukb/field.cgi?id=40000
p40001,Underlying (primary) cause of death: ICD10,44196,https://biobank.ndph.ox.ac.uk/ukb/field.cgi?id=40001
p40002,Contributory (secondary) causes of death: ICD10,29451,https://biobank.ndph.ox.ac.uk/ukb/field.cgi?id=40002
p40007,Age at death,44499,https://biobank.ndph.ox.ac.uk/ukb/field.cgi?id=40007
p40020,Death record origin,44499,https://biobank.ndph.ox.ac.uk/ukb/field.cgi?id=40020
p40022,Inpatient record origin,449193,https://biobank.ndph.ox.ac.uk/ukb/field.cgi?id=40022
p40023,Records in death dataset,44499,https://biobank.ndph.ox.ac.uk/ukb/field.cgi?id=40023
p40030,Sleep - Day hour average,99109,https://biobank.ndph.ox.ac.uk/ukb/field.cgi?id=40030
p40031,Sedentary - Day hour average,99109,https://biobank.ndph.ox.ac.uk/ukb/field.cgi?id=40031
p40032,Light - Day hour average,99109,https://biobank.ndph.ox.ac.uk/ukb/field.cgi?id=40032
p40033,Moderate-Vigorous - Day hour average,99109,https://biobank.ndph.ox.ac.uk/ukb/field.cgi?id=40033
p41202,Diagnoses - main ICD10,446969,https://biobank.ndph.ox.ac.uk/ukb/field.cgi?id=41202
p41203,Diagnoses - main ICD9,20390,https://biobank.ndph.ox.ac.uk/ukb/field.cgi?id=41203
p41204,Diagnoses - secondary ICD10,399976,https://biobank.ndph.ox.ac.uk/ukb/field.cgi?id=41204
p41205,Diagnoses - secondary ICD9,8742,https://biobank.ndph.ox.ac.uk/ukb/field.cgi?id=41205
p41270,Diagnoses - ICD10,446974,https://biobank.ndph.ox.ac.uk/ukb/field.cgi?id=41270
p41271,Diagnoses - ICD9,20390,https://biobank.ndph.ox.ac.uk/ukb/field.cgi?id=41271
